{
  "type": "question",
  "id": "q-0005",
  "stream": "visualization-tools-putnam",
  "text": "Is there any headroom for a tool to help - did the model already know the closed-form answers (memorization), and does prose chain-of-thought alone already solve these problems without any tools?",
  "status": "answered",
  "tags": [],
  "provenance": {
    "created_by": "claude",
    "created_at": "2026-06-11T03:06:55.279Z",
    "updated_at": "2026-06-11T03:07:39.765Z"
  },
  "comments": {},
  "stories": [
    "modality"
  ]
}
