{
  "type": "question",
  "id": "q-0004",
  "stream": "mathematical-domain-topology",
  "text": "Do different mathematical domains use genuinely different proof STRATEGIES, or only different theorem names?",
  "status": "answered",
  "tags": [],
  "provenance": {
    "created_by": "claude",
    "created_at": "2026-06-11T04:13:06.556Z",
    "updated_at": "2026-06-11T04:14:22.155Z"
  },
  "comments": {},
  "stories": [
    "domains"
  ]
}
