{
  "type": "question",
  "id": "q-0008",
  "stream": "slitherlink-tool-granularity",
  "text": "Do meta-tools (agent self-extension) affect solving, and can they be fairly and affordably tested?",
  "status": "answered",
  "tags": [],
  "provenance": {
    "created_by": "claude",
    "created_at": "2026-06-03T03:47:41.370Z",
    "updated_at": "2026-06-03T03:47:41.370Z",
    "source_ref": {
      "repo": "claude-sudoku-experiments",
      "commit": "0e31a015d8dab3348b6f48fdca81191e4ff97aa6"
    }
  },
  "comments": {}
}
