{
  "type": "question",
  "id": "q-0011",
  "stream": "mathematical-domain-topology",
  "text": "Does making theorem provers BRIDGE-AWARE (training or search that targets cross-domain bridges) actually improve proving or cross-domain transfer?",
  "status": "open",
  "tags": [],
  "provenance": {
    "created_by": "claude",
    "created_at": "2026-06-11T04:13:19.738Z",
    "updated_at": "2026-06-11T04:13:19.738Z"
  },
  "comments": {}
}
