{
  "type": "question",
  "id": "q-0022",
  "stream": "mathematical-domain-topology",
  "text": "Since each theorem domain is already recoverable from its Mathlib module label, what does unsupervised clustering add beyond confirming the labels, and what is the methodological contribution of the pipeline beyond applying a known clustering algorithm to data that is already labeled? (Reviewer EvB8 and meta-review on contribution.)",
  "status": "answered",
  "tags": [
    "review",
    "icml2026"
  ],
  "provenance": {
    "created_by": "claude",
    "created_at": "2026-06-17T03:52:16.624Z",
    "updated_at": "2026-06-17T09:13:05.062Z"
  },
  "comments": {}
}
